[
    {
        "name": "guzzlehttp/guzzle",
        "version": "7.0",
        "eco": "Packagist",
        "type": "manifest"
    },
    {
        "name": "guzzlehttp/guzzle",
        "version": "7.8.1",
        "eco": "Packagist",
        "type": "installed"
    },
    {
        "name": "laravel/framework",
        "version": "11.0.0",
        "eco": "Packagist",
        "type": "installed"
    }
]
