[
  {
    "name": "Newtonsoft.Json",
    "version": "12.0.3",
    "eco": "NuGet",
    "type": "manifest"
  },
  {
    "name": "Newtonsoft.Json",
    "version": "12.0.3",
    "eco": "NuGet",
    "type": "installed"
  },
  {
    "name": "Microsoft.Extensions.Logging.Abstractions",
    "version": "5.0.0",
    "eco": "NuGet",
    "type": "installed"
  }
]
