[
  {
    "name": "requests",
    "version": "2.31.0",
    "eco": "PyPI",
    "type": "manifest"
  },
  {
    "name": "requests",
    "version": "2.31.0",
    "eco": "PyPI",
    "type": "installed"
  },
  {
    "name": "urllib3",
    "version": "1.26.16",
    "eco": "PyPI",
    "type": "installed"
  }
]
