[
  {"name": "github.com/bytedance/sonic", "version": "1.15.0", "eco": "Go", "type": "locked"},
  {"name": "github.com/gin-contrib/sse", "version": "1.1.0", "eco": "Go", "type": "locked"},
  {"name": "gopkg.in/yaml.v3", "version": "3.0.1", "eco": "Go", "type": "locked"},
  {"name": "github.com/bytedance/gopkg", "version": "0.1.3", "eco": "Go", "type": "locked"},
  {"name": "golang.org/x/net", "version": "0.7.0", "eco": "Go", "type": "locked"}
]
