[
  {
    "name": "golang.org/x/net",
    "version": "0.6.0",
    "eco": "Go",
    "type": "locked"
  },
  {
    "name": "golang.org/x/text",
    "version": "0.8.0",
    "eco": "Go",
    "type": "locked"
  },
  {
    "name": "github.com/google/uuid",
    "version": "1.3.0",
    "eco": "Go",
    "type": "locked"
  }
]
